{"authority":{"comparison_establishes_general_model_quality":false,"comparison_scope":"exact_fixture_and_parent_evidence_identity_only"},"derived_noncanonical":true,"evaluation_identity":{"contract":"ai/consumer-evaluation-contract.json","contract_sha256":"ba32a03b90ec2f35b6533292bb6cc671e3273ec85249b89ee67c9a50687a031d","evaluation_index_sha256":"3d2d79e12af4a4d305043b6b8e01815ec2a64c0c702457090ecc62297111c468","index":"evaluations/index.json","parent_identity":{"ark":{"artifacts":[{"git_blob_sha1":"1a4860543488357321e1aad24ce36266769c5f39","path":"ai/minimum-recoverable-substrate.json"},{"git_blob_sha1":"dc7ea8e37772e677ee09f0e3a1447c2700a74789","path":"ai/recovery-tiers.json"},{"git_blob_sha1":"9016cf8e6641d48e639fb69cd5ad7f98a02840b7","path":"manifest.json"}],"pinned_commit":"f2bbf149abb3f8ccbfed158176873d813b66b546","protocol":"QSOL-ARK","repository":"https://github.com/QSOLKCB/QSOL-ARK"},"substrate":{"artifacts":[{"git_blob_sha1":"6abd254957843f2a0d42066423a5689099f85b6c","path":"ai/epistemic-contract.json"},{"git_blob_sha1":"bdc57ae303c2ce5b8498e3867d15d1804a59ba30","path":"ai/manifest.json"},{"git_blob_sha1":"9c830b095f59bbd948bf9ea5a8b35127121a7d99","path":"ai/mode-contract.json"}],"pinned_commit":"60e8cfeefa859df375f9f4d2fdb735edb1249db8","protocol":"QSOL-SUBSTRATE","repository":"https://github.com/QSOLKCB/QSOL-SUBSTRATE"}},"parent_identity_sha256":"666dad736c1b92cec599f1a7fd9e852542419a638fd5083c409dd10e20b857e8"},"fingerprint_sha256":"044f4dd82eed23b603690cd96c22876c1cc8878f27ce22f1d2e97a4589652d0a","left":{"overall_score":100,"report_fingerprint_sha256":"2641f2fa77e5a2e38aababe978ae42a13f730b86b5f69b2760e41311c8211b4b","run":{"claims_execution":false,"execution_kind":"synthetic_conformance","manifest_sha256":"96e0d72b5769f53531c522ebc7c74323b4844ba23835c65662f78399abb3d1f1","run_id":"synthetic-conformant","subject":{"id":"qsol-int.reference.conformant","identity_authentication":"not_claimed","kind":"reference_consumer","version":"1.0.0"}}},"metric_deltas":{"conflict_preservation":{"left":100,"right":0,"right_minus_left":-100},"invented_history_penalty":{"left":0,"right":100,"right_minus_left":100},"mode_boundary_discipline":{"left":100,"right":0,"right_minus_left":-100},"mrs_interpretation":{"left":100,"right":0,"right_minus_left":-100},"provenance_retention":{"left":100,"right":0,"right_minus_left":-100},"register_satire_preservation":{"left":100,"right":0,"right_minus_left":-100},"unknown_preservation":{"left":100,"right":0,"right_minus_left":-100}},"protocol":"QSOL-INT/CONSUMER-EVALUATION/1","right":{"overall_score":0,"report_fingerprint_sha256":"30ae8b18ee65bf549515abdb92d171e636b5f8f2a8069a3c8798dfab436da941","run":{"claims_execution":false,"execution_kind":"synthetic_conformance","manifest_sha256":"4234632ad185a8ee60d4950399a484db11ef0143065ae3d28e6298d1495a24f0","run_id":"synthetic-adversarial","subject":{"id":"qsol-int.reference.adversarial","identity_authentication":"not_claimed","kind":"reference_consumer","version":"1.0.0"}}},"type":"qsol-int-consumer-evaluation-comparison","version":"1.0.0","winner_by_overall_fixture_score":"left"}
